<?xml version="1.0" encoding="UTF-8" standalone="yes"?>
<livro xmlns="http://www.w3schools.com" xmlns:xsi="http://www.w3.org/2001/XMLSchema-instance" xsi:schemaLocation="http://www.w3schools.com livro.xsd">
    <titulo>a</titulo>
    <autor>
        <nome>Chaves</nome>
        <nascimento>12/12/2016</nascimento>
    </autor>
    <data>12/12/2016</data>
    <ISBN>123-123</ISBN>
    <editora>ADS</editora>
</livro>
